id,question
185,"けん引するための構造と装置のある大型車で、けん引されるための構造と装置のある車をけん引するときの最高速度は、４０キロメートル毎時である 。"
186,"普通免許を受けたものは、普通自動車、小型特殊自動車、一般原動機付自転車を運転することができる 。"
187,"仮運転免許は交通違反をしたり、交通事故を起こしても取り消しの対象になることはない 。"
188,"規制標識は特定の交通方法を禁止したり、特定の方法に従って通行するように指定したりするものである 。"
189,"オートマチック車のＰレンジは駐車時に使用するもので、走行中に使用すると非常に危険である 。"
190,"自動車を運転するとき、免許証または、免許情報記録個人番号カードを携帯しなければならないが、自動車損害賠償責任保険証明書は重要な書類であるから車とは別に保管しておくのがよい 。"
191,"交差点で正面の信号が赤の点滅をしているときは、一時停止するか、または徐行して交差点に入らなければならない 。"
192,"一般道路での普通乗用自動車の最高速度は６０キロメートル毎時であるが、普通貨物自動車の最高速度は５０キロメートル毎時である 。"
193,"白や黄色のつえを持って歩いている、目や耳の不自由な人のそばを通るときは、警音器を鳴らして注意をあたえて通過するのがよい 。"
194,"高齢運転者標識をつけて走行している車に対しは、危険を避けるためやむを得ない場合を除き、幅よせや割り込みをしてはならない 。"
195,"交通整理の行われていない道幅が同じ道路の交差点を通行するときは、左方からくる車の進行を妨げてはならない 。"
196,"一方通行の道路では、道路の中央より右側も通行することができる 。"
197,"見通しのよい道路のまがり角付近は、徐行しなくてよい 。"
198,"前車を追い越すときでも、定められた最高速度を超えることは出来ない 。"
199,"こう配の急な下り坂では自動車を追い越すことはできないが、一般原動機付自転車は追い越すことができる 。"
200,"６才未満の幼児を乗車させる場合、前席だけでなく、後部座席に乗車させる場合もチャイルドシートを用いなければならない 。"
